character,level,strokes,grade,freq,onyomi,kunyomi,meanings
党,N2,10,6,39,トウ,なかま; むら,party; faction; clique
協,N2,8,4,121,キョウ,,co-; cooperation
総,N2,14,5,129,ソウ,す.べて; すべ.て; ふさ,general; whole; all; full; total
区,N2,4,3,137,ク; オウ; コウ,,ward; district
領,N2,14,5,138,リョウ,えり,jurisdiction; dominion; territory; fief; reign
県,N2,9,3,140,ケン,か.ける,prefecture
設,N2,11,5,145,セツ,もう.ける,establishment; provision; prepare
改,N2,7,4,147,カイ,あらた.める; あらた.まる,reformation; change; modify; mend; renew; examine; inspect; search
府,N2,8,4,170,フ,,borough; urban prefecture; govt office; representative body; storehouse
査,N2,9,5,184,サ,,investigate
委,N2,8,3,187,イ,ゆだ.ねる,committee; entrust to; leave to; devote; discard
軍,N2,9,4,189,グン,いくさ,army; force; troops; war; battle
団,N2,6,5,213,ダン; トン,かたまり; まる.い,group; association
各,N2,6,4,243,カク,おのおの,each; every; either
島,N2,10,3,245,トウ,しま,island
革,N2,9,6,249,カク,かわ,leather; skin; reform; become serious
村,N2,7,1,253,ソン,むら,village; town
勢,N2,13,5,260,セイ; ゼイ,いきお.い; はずみ,forces; energy; military strength
減,N2,12,5,261,ゲン,へ.る; へ.らす,dwindle; decrease; reduce; decline; curtail; get hungry
再,N2,6,5,275,サイ; サ,ふたた.び,again; twice; second time
税,N2,12,5,289,ゼイ,,tax; duty
営,N2,12,5,303,エイ,いとな.む; いとな.み,camp; perform; build; conduct (business)
比,N2,4,5,329,ヒ,くら.べる,compare; race; ratio; Philippines
防,N2,7,5,331,ボウ,ふせ.ぐ,ward off; defend; protect; resist
補,N2,12,6,332,ホ,おぎな.う,supplement; supply; make good; offset; compensate; assistant; learner
境,N2,14,5,346,キョウ; ケイ,さかい,boundary; border; region
導,N2,15,5,354,ドウ,みちび.く,guidance; leading; conduct; usher
副,N2,11,4,360,フク,,vice-; assistant; aide; duplicate; copy
算,N2,14,2,361,サン,そろ,calculate; divining; number; abacus; probability
輸,N2,16,5,371,ユ; シュ,,transport; send; be inferior
述,N2,8,5,379,ジュツ,の.べる,mention; state; speak; relate
線,N2,15,2,382,セン,すじ,line; track
農,N2,13,3,385,ノウ,,agriculture; farmers
州,N2,6,3,386,シュウ; ス,す,state; province
武,N2,8,5,387,ブ; ム,たけ; たけ.し,warrior; military; chivalry; arms
象,N2,12,5,394,ショウ; ゾウ,かたど.る,elephant; pattern after; imitate; image; shape; sign (of the times)
域,N2,11,6,396,イキ,,range; region; limits; stage; level
額,N2,18,5,407,ガク,ひたい,forehead; tablet; plaque; framed picture; sum; amount; volume
欧,N2,8,8,421,オウ,うた.う; は.く,Europe
担,N2,8,6,422,タン,かつ.ぐ; にな.う,shouldering; carry; raise; bear
準,N2,13,5,425,ジュン,じゅん.じる; じゅん.ずる; なぞら.える; のり; ひと.しい; みずもり,semi-; correspond to; proportionate to; conform; imitate
賞,N2,15,5,426,ショウ,ほ.める,prize; reward; praise
辺,N2,5,4,428,ヘン,あた.り; ほと.り; -べ,environs; boundary; border; vicinity
造,N2,10,5,429,ゾウ,つく.る; つく.り; -づく.り,create; make; structure; physique
被,N2,10,8,431,ヒ,こうむ.る; おお.う; かぶ.る; かぶ.せる,incur; cover; veil; brood over; shelter; wear; put on; be exposed (film); receiving
技,N2,7,5,434,ギ,わざ,skill; art; craft; ability; feat; performance; vocation; arts
低,N2,7,4,435,テイ,ひく.い; ひく.める; ひく.まる,lower; short; humble
復,N2,12,5,438,フク,また,restore; return to; revert; resume
移,N2,11,5,448,イ,うつ.る; うつ.す,"shift; move; change; drift; catch (cold, fire); pass into"
個,N2,10,5,451,コ; カ,,individual; counter for articles
門,N2,8,2,452,モン,かど; と,gate; counter for cannons
課,N2,15,4,455,カ,,chapter; lesson; section; department; division; counter for chapters (of a book)
脳,N2,11,6,459,ノウ; ドウ,のうずる,brain; memory
極,N2,12,4,460,キョク; ゴク,きわ.める; きわ.まる; きわ.まり; きわ.み; き.める; -ぎ.め; き.まる,extreme; pole; extremely; very; highly; most; end; settlement; conclusion; highest rank
含,N2,7,8,466,ガン,ふく.む; ふく.める,contain; include; hold in the mouth; bear in mind; understand; cherish
蔵,N2,15,6,468,ゾウ; ソウ,くら; おさ.める; かく.れる,storehouse; hide; own; have; possess
量,N2,12,4,469,リョウ,はか.る,quantity; measure; weight; amount; consider; estimate; surmise
型,N2,9,5,482,ケイ,かた; -がた,mould; type; model
況,N2,8,8,490,キョウ,まし.て; いわ.んや; おもむき,condition; situation
針,N2,10,6,505,シン,はり,needle; pin; staple; stinger
専,N2,9,6,506,セン,もっぱ.ら,specialty; exclusive; mainly; solely
谷,N2,7,2,508,コク,たに; きわ.まる,valley
史,N2,5,5,511,シ,,history; chronicle
階,N2,12,3,513,カイ,きざはし,storey; stair; counter for storeys of a building
管,N2,14,4,517,カン,くだ,pipe; tube; wind instrument; drunken talk; control; jurisdiction
兵,N2,7,4,522,ヘイ; ヒョウ,つわもの,soldier; private; troops; army; warfare; strategy; tactics
接,N2,11,5,523,セツ; ショウ,つ.ぐ,touch; contact; adjoin; piece together
細,N2,11,2,537,サイ,ほそ.い; ほそ.る; こま.か; こま.かい,dainty; get thin; taper; slender; narrow; detailed; precise
効,N2,8,5,538,コウ,き.く; ききめ; なら.う,merit; efficacy; efficiency; benefit
丸,N2,3,2,542,ガン,まる; まる.める; まる.い,round; full (month); perfection; -ship; pills; make round; roll up; curl up; seduce; explain away
湾,N2,12,8,545,ワン,いりえ,gulf; bay; inlet
録,N2,16,4,546,ロク,しる.す; と.る,record
省,N2,9,4,548,セイ; ショウ,かえり.みる; はぶ.く,government ministry; conserve; omit
旧,N2,5,5,549,キュウ,ふる.い; もと,old times; old things; old friend; former; ex-
橋,N2,16,3,553,キョウ,はし,bridge
岸,N2,8,3,556,ガン,きし,beach
周,N2,8,4,562,シュウ,まわ.り,circumference; circuit; lap
材,N2,7,4,565,ザイ,,lumber; log; timber; wood; materials; ingredients; talent
戸,N2,4,2,575,コ,と,door; counter for houses; door radical (no. 63)
央,N2,5,3,582,オウ,,center; middle
券,N2,8,6,583,ケン,,ticket
編,N2,15,5,591,ヘン,あ.む; -あ.み,compilation; knit; plait; braid; twist; editing; completed poem; part of a book
捜,N2,10,8,592,ソウ; シュ; シュウ,さが.す,search; look for; locate
竹,N2,6,1,593,チク,たけ,bamboo
超,N2,12,8,597,チョウ,こ.える; こ.す,transcend; super-; ultra-
並,N2,8,6,599,ヘイ; ホウ,な.み; なみ; なら.べる; なら.ぶ; なら.びに,row; and; besides; as well as; line up; rank with; rival; equal
療,N2,17,8,600,リョウ,,heal; cure
採,N2,11,5,607,サイ,と.る,pick; take; fetch; take up
森,N2,12,1,609,シン,もり,forest; woods
競,N2,20,4,610,キョウ; ケイ,きそ.う; せ.る; くら.べる,emulate; compete with; bid; sell at auction; bout; contest; race
介,N2,4,8,617,カイ,,jammed in; shellfish; mediate; concern oneself with
根,N2,10,3,620,コン,ね; -ね,root; radical; head (pimple)
販,N2,11,8,627,ハン,,marketing; sell; trade
歴,N2,14,5,632,レキ; レッキ,,curriculum; continuation; passage of time
将,N2,10,6,634,ショウ; ソウ,まさ.に; はた; まさ; ひきい.る; もって,leader; commander; general; admiral; or; and again; soon; from now on; just about
幅,N2,12,8,641,フク,はば,hanging scroll; width
般,N2,10,8,649,ハン,,carrier; carry; all; general; sort; kind
貿,N2,12,5,652,ボウ,,trade; exchange
講,N2,17,5,653,コウ,,lecture; club; association
林,N2,8,1,656,リン,はやし,grove; forest
装,N2,12,6,657,ソウ; ショウ,よそお.う; よそお.い,attire; dress; pretend; disguise; profess
諸,N2,15,6,658,ショ,もろ,various; many; several; together
劇,N2,15,6,662,ゲキ,,drama; play
河,N2,8,5,663,カ,かわ,river
航,N2,10,5,665,コウ,,navigate; sail; cruise; fly
鉄,N2,13,3,672,テツ,くろがね,iron
児,N2,7,4,679,ジ; ニ; ゲイ,こ; -こ; -っこ,newborn babe; child; young of animals
禁,N2,13,5,681,キン,,prohibition; ban; forbid
印,N2,6,4,682,イン,しるし; -じるし; しる.す,stamp; seal; mark; imprint; symbol; emblem; trademark; evidence; souvenir; India
逆,N2,9,5,683,ギャク; ゲキ,さか; さか.さ; さか.らう,inverted; reverse; opposite; wicked
換,N2,12,8,687,カン,か.える; -か.える; か.わる,interchange; period; change; convert; replace; renew
久,N2,3,5,688,キュウ; ク,ひさ.しい,long time; old story
短,N2,12,3,689,タン,みじか.い,short; brevity; fault; defect; weak point
油,N2,8,3,690,ユ; ユウ,あぶら,oil; fat
暴,N2,15,5,692,ボウ; バク,あば.く; あば.れる,outburst; rave; fret; force; violence; cruelty; outrage
輪,N2,15,4,693,リン,わ,wheel; ring; circle; link; loop; counter for wheels and flowers
占,N2,5,8,694,セン,し.める; うらな.う,fortune-telling; divining; forecasting; occupy; hold; have; get; take
植,N2,12,3,699,ショク,う.える; う.わる,plant
清,N2,11,4,705,セイ; ショウ; シン,きよ.い; きよ.まる; きよ.める,pure; purify; cleanse; exorcise; Manchu dynasty
倍,N2,10,3,714,バイ,,double; twice; times; fold
均,N2,7,5,715,キン,なら.す,level; average
億,N2,15,4,716,オク,,hundred million; 10**8
圧,N2,5,5,718,アツ; エン; オウ,お.す; へ.す; おさ.える; お.さえる,pressure; push; overwhelm; oppress; dominate
芸,N2,7,4,719,ゲイ; ウン,う.える; のり; わざ,technique; art; craft; performance; acting; trick; stunt
署,N2,13,6,725,ショ,,signature; govt office; police station
伸,N2,7,8,730,シン,の.びる; の.ばす; の.べる; の.す,expand; stretch; extend; lengthen; increase
停,N2,11,5,733,テイ,と.める; と.まる,halt; stopping
爆,N2,19,8,735,バク,は.ぜる,bomb; burst open; pop; split
陸,N2,11,4,736,リク; ロク,おか,land; six
玉,N2,5,1,737,ギョク,たま; たま-; -だま,jewel; ball
波,N2,8,3,740,ハ,なみ,waves; billows; Poland
帯,N2,10,4,746,タイ,お.びる; おび,sash; belt; obi; zone; region
延,N2,8,6,747,エン,の.びる; の.べる; の.べ; の.ばす,prolong; stretching
羽,N2,6,2,748,ウ,は; わ; はね,"feathers; counter for birds, rabbits"
固,N2,8,4,750,コ,かた.める; かた.まる; かた.まり; かた.い,harden; set; clot; curdle
則,N2,9,5,753,ソク,のっと.る; のり; すなわち,rule; law; follow; based on; model after
乱,N2,7,6,755,ラン; ロン,みだ.れる; みだ.る; みだ.す; みだ; おさ.める; わた.る,riot; war; disorder; disturb
普,N2,12,8,757,フ,あまね.く; あまねし,universal; wide(ly); generally; Prussia
測,N2,12,5,761,ソク,はか.る,fathom; plan; scheme; measure
豊,N2,13,5,762,ホウ; ブ,ゆた.か; とよ,bountiful; excellent; rich
厚,N2,9,5,768,コウ,あつ.い; あか,thick; heavy; rich; kind; cordial; brazen; shameless
齢,N2,17,8,770,レイ,よわい; とし,age
囲,N2,7,5,771,イ,かこ.む; かこ.う; かこ.い,surround; besiege; store; paling; enclosure; encircle; preserve; keep
卒,N2,8,4,772,ソツ; シュツ,そっ.する; お.える; お.わる; ついに; にわか,graduate; soldier; private; die
略,N2,11,5,774,リャク,ほぼ; はぶ.く; おか.す; おさ.める; はかりごと; はか.る,abbreviation; omission; outline; shorten; capture; plunder
承,N2,8,6,775,ショウ; ジョウ,うけたまわ.る; う.ける,acquiesce; hear; listen to; be informed; receive
順,N2,12,4,779,ジュン,,obey; order; turn; right; docility; occasion
岩,N2,8,2,787,ガン,いわ,boulder; rock; cliff
練,N2,14,3,788,レン,ね.る; ね.り,practice; gloss; train; drill; polish; refine
軽,N2,12,3,790,ケイ; キョウ; キン,かる.い; かろ.やか; かろ.んじる,lightly; trifling; unimportant
了,N2,2,8,792,リョウ,,complete; finish
庁,N2,5,6,793,チョウ; テイ,やくしょ,government office
城,N2,9,4,795,ジョウ; セイ,しろ,castle
患,N2,11,8,796,カン,わずら.う,afflicted; disease; suffer from; be ill
層,N2,14,6,801,ソウ,,stratum; social class; layer; story; floor
版,N2,8,5,802,ハン,,printing block; printing plate; edition; impression; label
令,N2,5,4,804,レイ,,orders; laws; command; decree; good
角,N2,7,2,805,カク,かど; つの,angle; corner; square; horn; antlers
絡,N2,12,8,806,ラク,から.む; から.まる,entwine; coil around; get caught in
損,N2,13,5,807,ソン,そこ.なう; そこな.う; -そこ.なう; そこ.ねる; -そこ.ねる,damage; loss; disadvantage; hurt; injure
募,N2,12,8,809,ボ,つの.る,recruit; campaign; gather (contributions); enlist; grow violent
裏,N2,13,6,812,リ,うら,back; amidst; in; reverse; inside; palm; sole; rear; lining; wrong side
仏,N2,4,5,819,ブツ; フツ,ほとけ,Buddha; the dead; France
績,N2,17,5,820,セキ,,exploits; achievements; unreeling cocoons
築,N2,16,5,821,チク,きず.く,fabricate; build; construct
貨,N2,11,4,822,カ,たから,freight; goods; property
混,N2,11,5,824,コン,ま.じる; -ま.じり; ま.ざる; ま.ぜる; こ.む,mix; blend; confuse
昇,N2,8,8,826,ショウ,のぼ.る,rise up
池,N2,6,2,827,チ,いけ,pond; cistern; pool; reservoir
血,N2,6,3,832,ケツ,ち,blood
温,N2,12,3,838,オン,あたた.か; あたた.かい; あたた.まる; あたた.める; ぬく,warm
季,N2,8,4,842,キ,,seasons
星,N2,9,2,844,セイ; ショウ,ほし; -ぼし,star; spot; dot; mark
永,N2,5,5,846,エイ,なが.い,eternity; long; lengthy
著,N2,11,6,849,チョ; チャク,あらわ.す; いちじる.しい,renowned; publish; write; remarkable; phenomenal; put on; don; wear; arrival; finish (race); counter for suits of clothing; literary work
誌,N2,14,6,851,シ,,document; records
庫,N2,10,3,852,コ; ク,くら,warehouse; storehouse
刊,N2,5,5,855,カン,,publish; carve; engrave
像,N2,14,5,856,ゾウ,,statue; picture; image; figure; portrait
香,N2,9,4,859,コウ; キョウ,か; かお.り; かお.る,incense; smell; perfume
坂,N2,7,3,865,ハン,さか,slope; incline; hill
底,N2,8,4,867,テイ,そこ,bottom; sole; depth; bottom price; base; kind; sort
布,N2,5,5,877,フ; ホ,ぬの; し.く; きれ,linen; cloth; spread; distribute
寺,N2,6,2,879,ジ,てら,Buddhist temple
宇,N2,6,6,883,ウ,,eaves; roof; house; heaven
巨,N2,5,8,892,キョ,,gigantic; big; large; great
震,N2,15,8,893,シン,ふる.う; ふる.える; ふる.わせる; ふる.わす,quake; shake; tremble; quiver; shiver
希,N2,7,4,896,キ; ケ,まれ; こいねが.う,hope; beg; request; pray; beseech; Greece; dilute (acid); rare; few; phenomenal
触,N2,13,8,904,ショク,ふ.れる; さわ.る; さわ,contact; touch; feel; hit; proclaim; announce; conflict
依,N2,8,8,906,イ; エ,よ.る,reliant; depend on; consequently; therefore; due to
籍,N2,20,8,907,セキ,,enroll; domiciliary register; membership
汚,N2,6,8,908,オ,けが.す; けが.れる; けが.らわしい; よご.す; よご.れる; きたな.い,dirty; pollute; disgrace; rape; defile
枚,N2,8,6,911,マイ; バイ,,sheet of...; counter for flat thin objects or sheets
複,N2,14,5,915,フク,,duplicate; double; compound; multiple
郵,N2,11,6,917,ユウ,,mail; stagecoach stop
仲,N2,6,4,919,チュウ,なか,go-between; relationship
栄,N2,9,4,920,エイ; ヨウ,さか.える; は.え; -ば.え; は.える; え,flourish; prosperity; honor; glory; splendor
札,N2,5,4,921,サツ,ふだ,tag; paper money; counter for bonds; placard; bid
板,N2,8,3,926,ハン; バン,いた,plank; board; plate; stage
骨,N2,10,6,936,コツ,ほね,skeleton; bone; remains; frame
傾,N2,13,8,938,ケイ,かたむ.く; かたむ.ける; かたぶ.く; かた.げる; かし.げる,lean; incline; tilt; trend; wane; sink; ruin; bias
届,N2,8,6,939,カイ,とど.ける; -とど.け; とど.く,deliver; reach; arrive; report; notify; forward
巻,N2,9,6,944,カン; ケン,ま.く; まき; ま.き,scroll; volume; book; part; roll up; wind up; tie; coil; counter for texts (or book scrolls)
燃,N2,16,5,948,ネン,も.える; も.やす; も.す,burn; blaze; glow
跡,N2,13,8,953,セキ,あと,tracks; mark; print; impression
包,N2,5,4,954,ホウ,つつ.む; くる.む,wrap; pack up; cover; conceal
駐,N2,15,8,955,チュウ,,stop-over; reside in; resident
弱,N2,10,2,958,ジャク,よわ.い; よわ.る; よわ.まる; よわ.める,weak; frail
紹,N2,11,8,963,ショウ,,introduce; inherit; help
雇,N2,12,8,975,コ,やと.う,employ; hire
替,N2,12,8,979,タイ,か.える; か.え-; か.わる,exchange; spare; substitute; per-
預,N2,13,6,981,ヨ,あず.ける; あず.かる,deposit; custody; leave with; entrust to
焼,N2,12,4,982,ショウ,や.く; や.き; や.き-; -や.き; や.ける,bake; burning
簡,N2,18,6,983,カン; ケン,えら.ぶ; ふだ,simplicity; brevity
章,N2,11,3,990,ショウ,,badge; chapter; composition; poem; design
臓,N2,19,6,991,ゾウ,はらわた,entrails; viscera; bowels
律,N2,9,6,992,リツ; リチ; レツ,,rhythm; law; regulation; gauge; control
贈,N2,18,8,1001,ゾウ; ソウ,おく.る,presents; send; give to; award to; confer on; presenting something
照,N2,13,4,1004,ショウ,て.る; て.らす; て.れる,illuminate; shine; compare; bashful
薄,N2,16,8,1009,ハク,うす.い; うす-; -うす; うす.める; うす.まる; うす.らぐ; うす.ら-; うす.れる; すすき,dilute; thin; weak (tea); pampas grass
群,N2,13,4,1012,グン,む.れる; む.れ; むら; むら.がる,flock; group; crowd; herd; swarm; cluster
秒,N2,9,3,1015,ビョウ,,second (1/60 minute)
奥,N2,12,8,1018,オウ,おく; おく.まる; くま,heart; interior
詰,N2,13,8,1020,キツ; キチ,つ.める; つ.め; -づ.め; つ.まる; つ.む,packed; close; pressed; reprove; rebuke; blame
双,N2,4,8,1029,ソウ,ふた; たぐい; ならぶ; ふたつ,pair; set; comparison; counter for pairs
刺,N2,8,8,1031,シ,さ.す; さ.さる; さ.し; さし; とげ,thorn; pierce; stab; prick; sting; calling card
純,N2,10,6,1044,ジュン,,genuine; purity; innocence; net (profit)
翌,N2,11,6,1070,ヨク,,the following; next
快,N2,7,5,1074,カイ,こころよ.い,cheerful; pleasant; agreeable; comfortable
片,N2,4,6,1076,ヘン,かた-; かた,one-sided; leaf; sheet; right-side kata radical (no. 91)
敬,N2,12,6,1078,ケイ; キョウ,うやま.う,awe; respect; honor; revere
悩,N2,10,8,1084,ノウ,なや.む; なや.ます; なや.ましい; なやみ,trouble; worry; in pain; distress; illness
泉,N2,9,6,1086,セン,いずみ,spring; fountain
皮,N2,5,3,1092,ヒ,かわ,pelt; skin; hide; leather; skin radical (no. 107)
漁,N2,14,4,1094,ギョ; リョウ,あさ.る,fishing; fishery
荒,N2,9,8,1099,コウ,あ.らす; あ.れる; あら.い; すさ.ぶ; すさ.む; あ.らし,laid waste; rough; rude; wild
貯,N2,12,5,1100,チョ,た.める; たくわ.える,savings; store; lay in; keep; wear mustache
硬,N2,12,8,1101,コウ,かた.い,stiff; hard
埋,N2,10,8,1110,マイ,う.める; う.まる; う.もれる; うず.める; うず.まる; い.ける,bury; be filled up; embedded
柱,N2,9,3,1119,チュウ,はしら,pillar; post; cylinder; support
祭,N2,11,3,1124,サイ,まつ.る; まつ.り; まつり,ritual; offer prayers; celebrate; deify; enshrine; worship
袋,N2,11,8,1125,タイ; ダイ,ふくろ,sack; bag; pouch
筆,N2,12,3,1132,ヒツ,ふで,writing brush; writing; painting brush; handwriting
訓,N2,10,4,1134,クン; キン,おし.える; よ.む; くん.ずる,instruction; Japanese character reading; explanation; read
浴,N2,10,4,1136,ヨク,あ.びる; あ.びせる,bathe; be favored with; bask in
童,N2,12,3,1138,ドウ,わらべ,juvenile; child
宝,N2,8,6,1139,ホウ,たから,treasure; wealth; valuables
封,N2,9,8,1143,フウ; ホウ,,seal; closing
胸,N2,10,6,1144,キョウ,むね; むな-,bosom; breast; chest; heart; feelings
砂,N2,9,6,1146,サ; シャ,すな,sand
塩,N2,13,4,1148,エン,しお,salt
賢,N2,16,8,1159,ケン,かしこ.い,intelligent; wise; wisdom; cleverness
腕,N2,12,8,1163,ワン,うで,arm; ability; talent
兆,N2,6,4,1174,チョウ,きざ.す; きざ.し,portent; 10**12; trillion; sign; omen; symptoms
床,N2,7,8,1175,ショウ,とこ; ゆか,bed; counter for beds; floor; padding; tatami
毛,N2,4,2,1179,モウ,け,fur; hair; feather; down
緑,N2,14,3,1180,リョク; ロク,みどり,green
尊,N2,12,6,1181,ソン,たっと.い; とうと.い; たっと.ぶ; とうと.ぶ,revered; valuable; precious; noble; exalted
祝,N2,9,4,1184,シュク; シュウ,いわ.う,celebrate; congratulate
柔,N2,9,8,1187,ジュウ; ニュウ,やわ.らか; やわ.らかい; やわ; やわ.ら,tender; weakness; gentleness; softness
殿,N2,13,8,1199,デン; テン,との; -どの,Mr.; hall; mansion; palace; temple; lord
濃,N2,16,8,1200,ノウ,こ.い,concentrated; thick; dark; undiluted
液,N2,11,5,1210,エキ,,fluid; liquid; juice; sap; secretion
衣,N2,6,4,1214,イ; エ,ころも; きぬ; -ぎ,garment; clothes; dressing
肩,N2,8,8,1215,ケン,かた,shoulder
零,N2,13,8,1217,レイ,ぜろ; こぼ.す; こぼ.れる,zero; spill; overflow; nothing; cipher
幼,N2,5,6,1227,ヨウ,おさな.い,infancy; childhood
荷,N2,10,3,1230,カ,に,baggage; shoulder-pole load; bear (a burden); shoulder (a gun); load; cargo; freight
泊,N2,8,8,1233,ハク,と.まる; と.める,overnight stay; put up at; ride at anchor
黄,N2,11,2,1240,コウ; オウ,き; こ-,yellow
甘,N2,5,8,1248,カン,あま.い; あま.える; あま.やかす; うま.い,sweet; coax; pamper; be content; sugary
臣,N2,7,4,1249,シン; ジン,,retainer; subject
浅,N2,9,4,1253,セン,あさ.い,shallow; superficial; frivolous; wretched; shameful
掃,N2,11,8,1255,ソウ; シュ,は.く,sweep; brush
雲,N2,12,2,1256,ウン,くも; -ぐも,cloud
掘,N2,11,8,1257,クツ,ほ.る,dig; delve; excavate
捨,N2,11,6,1266,シャ,す.てる,discard; throw away; abandon; resign; reject; sacrifice
軟,N2,11,8,1269,ナン,やわ.らか; やわ.らかい,soft
沈,N2,7,8,1271,チン; ジン,しず.む; しず.める,sink; be submerged; subside; be depressed; aloes
凍,N2,10,8,1284,トウ,こお.る; こご.える; こご.る; い.てる; し.みる,frozen; congeal; refrigerate
乳,N2,8,6,1289,ニュウ,ちち; ち,milk; breasts
恋,N2,10,8,1296,レン,こ.う; こい; こい.しい,romance; in love; yearn for; miss; darling
紅,N2,9,6,1299,コウ; ク,べに; くれない; あか.い,crimson; deep red
郊,N2,9,8,1304,コウ,,outskirts; suburbs; rural area
腰,N2,13,8,1306,ヨウ,こし,loins; hips; waist; low wainscoting
炭,N2,9,3,1307,タン,すみ,charcoal; coal
踊,N2,14,8,1308,ヨウ,おど.る,jump; dance; leap; skip
冊,N2,5,6,1313,サツ; サク,ふみ,tome; counter for books; volume
勇,N2,9,4,1319,ユウ,いさ.む,courage; cheer up; be in high spirits; bravery; heroism
械,N2,11,4,1321,カイ,かせ,contraption; fetter; machine; instrument
菜,N2,11,4,1327,サイ,な,vegetable; side dish; greens
珍,N2,9,8,1330,チン,めずら.しい; たから,rare; curious; strange
卵,N2,7,6,1342,ラン,たまご,egg; ovum; spawn; roe
湖,N2,12,3,1344,コ,みずうみ,lake
喫,N2,12,8,1347,キツ,の.む,consume; eat; drink; smoke; receive (a blow)
干,N2,3,6,1349,カン,ほ.す; ほ.し-; -ぼ.し; ひ.る,dry; parch; ebb; recede; interfere; intercede
虫,N2,6,1,1351,チュウ; キ,むし,insect; bug; temper
刷,N2,8,4,1352,サツ,す.る; -ず.り; -ずり; は.く,printing; print; brush
湯,N2,12,3,1356,トウ,ゆ,hot water; bath; hot spring
溶,N2,13,8,1364,ヨウ,と.ける; と.かす; と.く,melt; dissolve; thaw
鉱,N2,13,5,1376,コウ,あらがね,mineral; ore
涙,N2,10,8,1381,ルイ; レイ,なみだ,tears; sympathy
匹,N2,4,8,1384,ヒツ,ひき,equal; head; counter for small animals; roll of cloth
孫,N2,10,4,1388,ソン,まご,grandchild; descendants
鋭,N2,15,8,1395,エイ,するど.い,pointed; sharpness; edge; weapon; sharp; violent
枝,N2,8,5,1401,シ,えだ,bough; branch; twig; limb; counter for branches
塗,N2,13,8,1414,ト,ぬ.る; ぬ.り; まみ.れる,paint; plaster; daub; smear; coating
軒,N2,10,8,1416,ケン,のき,flats; counter for houses; eaves
毒,N2,8,5,1419,ドク,,poison; virus; venom; germ; harm; injury; spite
叫,N2,6,8,1426,キョウ,さけ.ぶ,shout; exclaim; yell
拝,N2,8,6,1443,ハイ,おが.む; おろが.む,worship; adore; pray to
氷,N2,5,3,1450,ヒョウ,こおり; ひ; こお.る,icicle; ice; hail; freeze; congeal
乾,N2,11,8,1453,カン; ケン,かわ.く; かわ.かす; ほ.す; ひ.る; いぬい,drought; dry; desiccate; drink up; heaven; emperor
棒,N2,12,6,1455,ボウ,,rod; stick; cane; pole; club; line
祈,N2,8,8,1462,キ,いの.る,pray; wish
拾,N2,9,3,1479,シュウ; ジュウ,ひろ.う,pick up; gather; find; go on foot; ten
粉,N2,10,5,1484,フン,デシメートル; こ; こな,flour; powder; dust
糸,N2,6,1,1488,シ,いと,thread
綿,N2,14,5,1495,メン,わた,cotton
汗,N2,6,8,1502,カン,あせ,sweat; perspire
銅,N2,14,5,1505,ドウ,あかがね,copper
湿,N2,12,8,1517,シツ; シュウ,しめ.る; しめ.す; うるお.う; うるお.す,damp; wet; moist
瓶,N2,11,8,1528,ビン; ヘイ,かめ,bottle; vial; jar; jug; vat; urn
咲,N2,9,8,1534,ショウ,さ.く; -ざき,blossom; bloom
召,N2,5,8,1540,ショウ,め.す,seduce; call; send for; wear; put on; ride in; buy; eat; drink; catch (cold)
缶,N2,6,8,1543,カン,かま,tin can; container; jar radical (no. 121)
隻,N2,10,8,1546,セキ,,vessels; counter for ships; fish; birds; arrows; one of a pair
脂,N2,10,8,1548,シ,あぶら,fat; grease; tallow; lard; rosin; gum; tar
蒸,N2,13,6,1552,ジョウ; セイ,む.す; む.れる; む.らす,steam; heat; sultry; foment; get musty
肌,N2,6,8,1559,キ,はだ,texture; skin; body; grain
耕,N2,10,5,1568,コウ,たがや.す,till; plow; cultivate
鈍,N2,12,8,1574,ドン,にぶ.い; にぶ.る; にぶ-; なま.る; なまく.ら,dull; slow; foolish; blunt
泥,N2,8,8,1589,デイ; ナイ; デ; ニ,どろ; なず.む,mud; mire; adhere to; be attached to
