character,level,strokes,grade,freq,onyomi,kunyomi,meanings
隅,N2,12,8,1601,グウ,すみ,corner; nook
灯,N2,6,4,1605,トウ,ひ; ほ-; ともしび; とも.す; あかり,lamp; a light; light; counter for lights
辛,N2,7,8,1607,シン,から.い; つら.い; -づら.い; かのと,spicy; bitter; hot; acrid
磨,N2,16,8,1608,マ,みが.く; す.る,grind; polish; scour; improve; brush (teeth)
麦,N2,7,2,1615,バク,むぎ,barley; wheat
姓,N2,8,8,1628,セイ; ショウ,,surname
筒,N2,12,8,1631,トウ,つつ,cylinder; pipe; tube; gun barrel; sleeve
鼻,N2,14,3,1632,ビ,はな,nose; snout
粒,N2,11,8,1635,リュウ,つぶ,grains; drop; counter for tiny particles
詞,N2,12,6,1636,シ,ことば,part of speech; words; poetry
胃,N2,9,6,1647,イ,,stomach; paunch; crop; craw
畳,N2,12,8,1665,ジョウ; チョウ,たた.む; たたみ; かさ.なる,tatami mat; counter for tatami mats; fold; shut up; do away with
机,N2,6,6,1671,キ,つくえ,desk; table
膚,N2,15,8,1679,フ,はだ,skin; body; grain; texture; disposition
濯,N2,17,8,1698,タク,すす.ぐ; ゆす.ぐ,laundry; wash; pour on; rinse
塔,N2,12,8,1708,トウ,,pagoda; tower; steeple
沸,N2,8,8,1709,フツ,わ.く; わ.かす,seethe; boil; ferment; uproar; breed
灰,N2,6,6,1717,カイ,はい,ashes; puckery juice; cremate
菓,N2,11,8,1719,カ,,candy; cakes; fruit
帽,N2,12,8,1742,ボウ; モウ,ずきん; おお.う,cap; headgear
枯,N2,9,8,1749,コ,か.れる; か.らす,wither; die; dry up; be seasoned
涼,N2,11,8,1783,リョウ,すず.しい; すず.む; すず.やか; うす.い; ひや.す; まことに,refreshing; nice and cool
舟,N2,6,8,1786,シュウ,ふね; ふな-; -ぶね,boat; ship
貝,N2,7,1,1787,バイ,かい,shellfish
符,N2,11,8,1798,フ,,token; sign; mark; tally; charm
憎,N2,14,8,1808,ゾウ,にく.む; にく.い; にく.らしい; にく.しみ,hate; detest
皿,N2,5,3,1812,ベイ,さら,dish; a helping; plate
肯,N2,8,8,1813,コウ,がえんじ.る,agreement; consent; comply with
燥,N2,17,8,1819,ソウ,はしゃ.ぐ,parch; dry up
畜,N2,10,8,1824,チク,,livestock; domestic fowl and animals
挟,N2,9,8,1870,キョウ; ショウ,はさ.む; はさ.まる; わきばさ.む; さしはさ.む,pinch; between
曇,N2,16,8,1899,ドン,くも.る,cloudy weather; cloud up
滴,N2,14,8,2019,テキ,しずく; したた.る,drip; drop
伺,N2,7,8,2209,シ,うかが.う,pay respects; visit; ask; inquire; question; implore
